date,data,url
2018-07-09,"Tata Investment Corporation (0.92 per cent up), Tata Metaliks (2.27 per cent), Tata Power Coltd (2.09 per cent up), Tata Sponge Iron (4.11 per cent up), and Tata Teleservices (Maharashtra) (0.22 per cent up) also made smart gains.Tata Consultancy Services (TCS), however, closed lower by 1.34 per cent, ahead of its June quarter results scheduled to be declared on Tuesday.The National Company Law Tribunal (NCLT) dismissed Mr Mistry's plea challenging his removal as Tata Sons chairman in 2016. The tribunal did not find any merit in legacy issues raised by Mr Mistry against Tata Sons.After a tribunal, on Monday, dismissed Cyrus Mistry's appeal against Tata Group on his removal as chairman of Tata Sons, most of the group stocks ended higher in trade. Tata Consultancy Services (TCS), however, bucked the positive trend of other group stocks. After the announcement of the verdict in favour of Tata Sons, most of Tata Group stocks traded higher on the Bombay Stock Exchange. Tata Steel (0.49 per cent up), Tata Motors (0.81 per cent up), Tata Chemicals (1.61 per cent up), Tata Coffee (0.68 per cent up), Tata Communications (2.11 per cent up), Tata Elxsi (1.36 per cent up), and Tata Global Beverages Limited (3.07 per cent up) made solid gains.Tata Investment Corporation (0.92 per cent up), Tata Metaliks (2.27 per cent), Tata Power Coltd (2.09 per cent up), Tata Sponge Iron (4.11 per cent up), and Tata Teleservices (Maharashtra) (0.22 per cent up) also made smart gains.Tata Consultancy Services (TCS), however, closed lower by 1.34 per cent, ahead of its June quarter results scheduled to be declared on Tuesday.The National Company Law Tribunal (NCLT) dismissed Mr Mistry's plea challenging his removal as Tata Sons chairman in 2016. The tribunal did not find any merit in legacy issues raised by Mr Mistry against Tata Sons.Mr Mistry said that he was disappointed with the verdict and ""an appeal on merits will be pursued"" against the ruling.In his plea, Mr Mistry had said that his removal as Tata Sons' chairman was illegal. He had also alleged mismanagement at Tata Sons, oppression of minority shareholders, a breakdown of corporate governance and excessive interference by Tata Trusts.Meanwhile, in afternoon trade, the S&P BSE Sensex traded higher by 286.50 points at 35,944.36 and the broader Nifty50 was above 10,850 level. googletag.cmd.push(function() { googletag.display(""adslotNativeVideo""); });Get the latest election news, live updates and election schedule for Lok Sabha Elections 2019 on ndtv.com/elections. Like us on Facebook or follow us on Twitter and Instagram for updates from each of the 543 parliamentary seats for the 2019 Indian general elections.",https://www.ndtv.com/business/tata-sons-vs-cyrus-mistry-tata-group-stocks-tata-steel-tata-consultancy-services-tcs-1880203
2018-09-15,"கொல்கத்தா: ஐந்து முறை செஸ் போட்டியில் உலக சாம்பியன் பட்டத்தை வென்ற விஸ்வநாதன் ஆனந்த், இந்தியாவில் நடக்கும் டாடா ஸ்டீல் செஸ் ராபிட் ப்ளிட்ஸ் தொடரில் பங்கேற்க உள்ளார்நவம்பர் 9 ஆம் தேதி முதல் 14 ஆம் தேதி வரை நடைப்பெற உள்ள இந்த செஸ் தொடரில், முக்கிய போட்டியாளர்கள் பங்கேற்க உள்ளனர். இது குறித்து பேசிய விஸ்வநாதன் ஆனந்த், 32 ஆண்டுகளுக்கு பிறகு கொல்கத்தாவில் நடக்கும் முக்கிய செஸ் போட்டியில் பங்கேற்க உள்ளதாக தெரிவித்துள்ளார்“1986 ஆம் ஆண்டு கொல்கத்தாவில் நடைப்பெற்ற கிராண்ட் மாஸ்டர் போட்டியில் நான் கலந்து கொண்டேன். அதனை தொடர்ந்து, இந்தாண்டு நடைப்பெறும் போட்டியில் பங்கேற்பது குறித்து மகிழ்ச்சி அடைகிறேன்” என்றார்டாடா செஸ் போட்டியில் வெற்றி பெறுபவர்களுக்கு 40,000 அமெரிக்க டாலர் பரிசாக அறிவிக்கப்பட்டுள்ளது குறிப்பிடத்தக்கது. “இந்தியாவில் உள்ள செஸ் ஆர்வலர்களுக்கு இந்த தொடர் ஊக்கமளிப்பதாக இருக்கும். இந்த போட்டி தொடரை இந்திய மக்கள் பலரும் கண்டு களிப்பார்கள் என்று எதிர்ப்பார்க்கிறேன்” என்றார்போட்டி சுற்று தொடங்கும் முன், அனைத்து வீரர்களும் பங்கேற்பாளர் சுற்றுகளில் விளையாட உள்ளனர். இந்தியா சார்பில் ஹரி கிருஷ்ணா, சூர்யா சேகர் கங்குலி, விதித் குஜராத்தி, பிரகனாநந்தா ஆகியோரும் கலந்து கொள்கின்றனர்கொல்கத்தா: ஐந்து முறை செஸ் போட்டியில் உலக சாம்பியன் பட்டத்தை வென்ற விஸ்வநாதன் ஆனந்த், இந்தியாவில் நடக்கும் டாடா ஸ்டீல் செஸ் ராபிட் ப்ளிட்ஸ் தொடரில் பங்கேற்க உள்ளார்நவம்பர் 9 ஆம் தேதி முதல் 14 ஆம் தேதி வரை நடைப்பெற உள்ள இந்த செஸ் தொடரில், முக்கிய போட்டியாளர்கள் பங்கேற்க உள்ளனர். இது குறித்து பேசிய விஸ்வநாதன் ஆனந்த், 32 ஆண்டுகளுக்கு பிறகு கொல்கத்தாவில் நடக்கும் முக்கிய செஸ் போட்டியில் பங்கேற்க உள்ளதாக தெரிவித்துள்ளார்“1986 ஆம் ஆண்டு கொல்கத்தாவில் நடைப்பெற்ற கிராண்ட் மாஸ்டர் போட்டியில் நான் கலந்து கொண்டேன். அதனை தொடர்ந்து, இந்தாண்டு நடைப்பெறும் போட்டியில் பங்கேற்பது குறித்து மகிழ்ச்சி அடைகிறேன்” என்றார்googletag.cmd.push(function() { googletag.display(""adslotNativeVideo""); });டாடா செஸ் போட்டியில் வெற்றி பெறுபவர்களுக்கு 40,000 அமெரிக்க டாலர் பரிசாக அறிவிக்கப்பட்டுள்ளது குறிப்பிடத்தக்கது. “இந்தியாவில் உள்ள செஸ் ஆர்வலர்களுக்கு இந்த தொடர் ஊக்கமளிப்பதாக இருக்கும். இந்த போட்டி தொடரை இந்திய மக்கள் பலரும் கண்டு களிப்பார்கள் என்று எதிர்ப்பார்க்கிறேன்” என்றார்போட்டி சுற்று தொடங்கும் முன், அனைத்து வீரர்களும் பங்கேற்பாளர் சுற்றுகளில் விளையாட உள்ளனர். இந்தியா சார்பில் ஹரி கிருஷ்ணா, சூர்யா சேகர் கங்குலி, விதித் குஜராத்தி, பிரகனாநந்தா ஆகியோரும் கலந்து கொள்கின்றனர்(இந்த செய்தி NDTV ஊழியரால் எடிட் செய்யப்படவில்லை. சிண்டிகேட்டெட் ஃபீட் மூலம் தானாக உருவாக்கப்பட்டது.)சமீபத்திய தமிழ்நாட்டுச் செய்திகள், சென்னை செய்திகள், அரசியல், வர்த்தகம், தொழில்நுட்பம், கிரிக்கெட் ஆகியவற்றின் தலைப்புச் செய்திகள் என ஒவ்வொரு நிகழ்வுகளையும் பற்றி தமிழில் படிக்க பேஸ்புக் மற்றும் ட்விட்டர் NDTV Tamilஐ பின் தொடருங்கள்.",https://www.ndtv.com/tamil/anand-to-be-star-attraction-at-tata-steel-rapid-blitz-in-november-1917119
2018-09-22,"टाटा स्टील ने शनिवार को ऐलान किया कि वह 4,300-4,700 करोड़ रुपये में उषा मार्टिन लिमिटेड (यूएमएल) के इस्पात कारोबार का अधिग्रहण करेगी. यूएमएल ने शेयर बाजार को उपलब्ध करायी गयी अपनी जानकारी में कहा है कि इस्पात कारोबार को टाटा को बेचने से कंपनी को अपने कर्जे बहुत हद तक कम करने में मदद मिलेगी. उसने कहा है कि इस सौदे के छह से नौ माह के समय में पूरा होने की संभावना है. टाटा स्टील ने एक विज्ञप्ति जारी कर कहा है कि उसने यूएमएल के इस्पात कारोबार के अधिग्रहण के लिए एक करार किया है. विज्ञप्ति के अनसार लेन देन में समायोजन के बाद यह सौदा नकद 4,300-4,700 करोड़ रुपये के बीच का होगा.गौरतलब है कि घरेलू इस्पात कंपनी टाटा स्टील ने बीते वित्त वर्ष की मार्च में समाप्त चौथी तिमाही में 14,688.02 करोड़ रुपये का एकीकृत शुद्ध लाभ कमाया है. बंबई शेयर बाजार को भेजी सूचना में कंपनी ने यह जानकारी दी. इससे पिछले वित्त वर्ष की समान तिमाही में कंपनी को 1,168.02 करोड़ रुपये का शुद्ध नुकसान हुआ था. तिमाही के दौरान कंपनी की कुल एकीकृत आय बढ़कर 36,407.19 करोड़ रुपये पर पहुंच गई , जो इससे पिछले वित्त वर्ष की समान तिमाही में 35,457.06 करोड़ रुपये थी.तिमाही के दौरान कंपनी का कुल खर्च 32,626.42 करोड़ रुपये रहा , जो इससे पिछले वित्त वर्ष की समान तिमाही में 31,132.02 करोड़ रुपये था. कंपनी के मुख्य कार्यकारी अधिकारी और प्रबंध निदेशक टी वी नरेंद्रन ने कहा , ‘‘ टाटा स्टील ने बीते वित्त वर्ष में बेहतरीन प्रदर्शन किया. हमारी ठोस क्रियान्वयन नीति तथा वैश्विक स्तर पर अनुकूल मांग - आपूर्ति संतुलन की वजह से हम यह प्रदर्शन हासिल कर पाए. ’’ उन्होंने कहा कि कलिंगनगर संयंत्र के विस्तार तथा मार्केटिंग नेटवर्क और ब्रांड इक्विटी की मजबूती से हमारे भारतीय परिचालन ने बाजार की तुलना में बेहतर प्रदर्शन किया.नई दिल्ली: टाटा स्टील ने शनिवार को ऐलान किया कि वह 4,300-4,700 करोड़ रुपये में उषा मार्टिन लिमिटेड (यूएमएल) के इस्पात कारोबार का अधिग्रहण करेगी. यूएमएल ने शेयर बाजार को उपलब्ध करायी गयी अपनी जानकारी में कहा है कि इस्पात कारोबार को टाटा को बेचने से कंपनी को अपने कर्जे बहुत हद तक कम करने में मदद मिलेगी. उसने कहा है कि इस सौदे के छह से नौ माह के समय में पूरा होने की संभावना है. टाटा स्टील ने एक विज्ञप्ति जारी कर कहा है कि उसने यूएमएल के इस्पात कारोबार के अधिग्रहण के लिए एक करार किया है. विज्ञप्ति के अनसार लेन देन में समायोजन के बाद यह सौदा नकद 4,300-4,700 करोड़ रुपये के बीच का होगा. गौरतलब है कि घरेलू इस्पात कंपनी टाटा स्टील ने बीते वित्त वर्ष की मार्च में समाप्त चौथी तिमाही में 14,688.02 करोड़ रुपये का एकीकृत शुद्ध लाभ कमाया है. बंबई शेयर बाजार को भेजी सूचना में कंपनी ने यह जानकारी दी. इससे पिछले वित्त वर्ष की समान तिमाही में कंपनी को 1,168.02 करोड़ रुपये का शुद्ध नुकसान हुआ था. तिमाही के दौरान कंपनी की कुल एकीकृत आय बढ़कर 36,407.19 करोड़ रुपये पर पहुंच गई , जो इससे पिछले वित्त वर्ष की समान तिमाही में 35,457.06 करोड़ रुपये थी. googletag.cmd.push(function() { googletag.display(""adslotNativeVideo""); }); तिमाही के दौरान कंपनी का कुल खर्च 32,626.42 करोड़ रुपये रहा , जो इससे पिछले वित्त वर्ष की समान तिमाही में 31,132.02 करोड़ रुपये था. कंपनी के मुख्य कार्यकारी अधिकारी और प्रबंध निदेशक टी वी नरेंद्रन ने कहा , ‘‘ टाटा स्टील ने बीते वित्त वर्ष में बेहतरीन प्रदर्शन किया. हमारी ठोस क्रियान्वयन नीति तथा वैश्विक स्तर पर अनुकूल मांग - आपूर्ति संतुलन की वजह से हम यह प्रदर्शन हासिल कर पाए. ’’ उन्होंने कहा कि कलिंगनगर संयंत्र के विस्तार तथा मार्केटिंग नेटवर्क और ब्रांड इक्विटी की मजबूती से हमारे भारतीय परिचालन ने बाजार की तुलना में बेहतर प्रदर्शन किया. बिजनेस  जगत में होने वाली हर हलचल के अपडेट पाने के लिए हमें Facebook पर ज्वॉइन और Twitter पर फॉलो करें.Get the latest election news, live updates and election schedule for Lok Sabha Elections 2019 on ndtv.com/elections. Like us on Facebook or follow us on Twitter and Instagram for updates from each of the 543 parliamentary seats for the 2019 Indian general elections.",https://www.ndtv.com/business/hindi/tata-steel-will-acquire-usha-martin-1920652
2018-09-30,"After acquiring debt-laden Bhushan Steel through the insolvency and bankruptcy process, Tata Steel is now aiming to raise its production to 4 million tonne (MT) by the end of the current fiscal, an official said. Bhushan Steel's Odisha plant is presently operating at 3.5 MT against a capacity of 5 MT, the official said. ""The Bhushan plant in Odisha has a capacity of 5 MT but is currently operating at 3.5 MT.We are working to raise the production at least to a level of 4 MT a year by March 2019 as demand remains robust,"" the official, who is part of the new team installed by Tata Steel in the company, told PTI. The Bhushan Steel plant is located close to TataSteel's Kalinganagar facility where it has a 3 MT capacity.The official said the Kalinganagar plant expansion is on track despite Bhushan's takeover at Rs 36,000 crore. ""Safety and environment aspects need to be strengthened in Bhushan Steel as they are not up to our (TataSteel's) internal standards,"" he said. The new plant will follow Tata Steel's strategy of not just being a steel producer but a service company with extensive use of technology. Though Bhushan Steel will continue to be operated as a standalone outfit for the time being, a change of name is imminent to make it resemble a Tata company. The new management will be leveraging and complementing marketing strengths of Tata Steel, the official said. Tata Steel had earlier said there was a lot of synergies in taking over Bhushan Steel. Tata Steel took almost a decade to build 3 MT plant at Kalinganagar while the takeover of Bhushan Steel offered the steel major a readily available 5 MT plant, boosting its flat products.After acquiring debt-laden Bhushan Steel through the insolvency and bankruptcy process, Tata Steel is now aiming to raise its production to 4 million tonne (MT) by the end of the current fiscal, an official said. Bhushan Steel's Odisha plant is presently operating at 3.5 MT against a capacity of 5 MT, the official said. ""The Bhushan plant in Odisha has a capacity of 5 MT but is currently operating at 3.5 MT. We are working to raise the production at least to a level of 4 MT a year by March 2019 as demand remains robust,"" the official, who is part of the new team installed by Tata Steel in the company, told PTI. The Bhushan Steel plant is located close to TataSteel's Kalinganagar facility where it has a 3 MT capacity. googletag.cmd.push(function() { googletag.display(""adslotNativeVideo""); });The official said the Kalinganagar plant expansion is on track despite Bhushan's takeover at Rs 36,000 crore. ""Safety and environment aspects need to be strengthened in Bhushan Steel as they are not up to our (TataSteel's) internal standards,"" he said. The new plant will follow Tata Steel's strategy of not just being a steel producer but a service company with extensive use of technology. Though Bhushan Steel will continue to be operated as a standalone outfit for the time being, a change of name is imminent to make it resemble a Tata company. The new management will be leveraging and complementing marketing strengths of Tata Steel, the official said. Tata Steel had earlier said there was a lot of synergies in taking over Bhushan Steel. Tata Steel took almost a decade to build 3 MT plant at Kalinganagar while the takeover of Bhushan Steel offered the steel major a readily available 5 MT plant, boosting its flat products. (Except for the headline, this story has not been edited by NDTV staff and is published from a syndicated feed.)Get the latest election news, live updates and election schedule for Lok Sabha Elections 2019 on ndtv.com/elections. Like us on Facebook or follow us on Twitter and Instagram for updates from each of the 543 parliamentary seats for the 2019 Indian general elections.",https://www.ndtv.com/business/tata-steel-aims-to-raise-production-to-4-million-tonne-by-fy19-end-at-bhushan-steel-1924544
2018-10-10,"AirAsia India did not immediately respond to a request for comment. Bhaskaran could not immediately be reached.AirAsia India has seen several high-profile exits in recent months and has been without a CEO for nearly six months. Bhaskaran's appointment would also come at a time when the airline and some of its executives are being investigated for alleged wrongdoing.Indian police in May filed a case against AirAsia Group, CEO Tony Fernandes and its domestic entity AirAsia India, over allegations of corruption and breaking rules in obtaining a flying licence.The Central Bureau of Investigation (CBI) accused the airline, some of its employees and third parties of violating India's foreign direct investment rules while obtaining the licence, and of allegedly bribing government officials in an attempt to get regulations relaxed to allow AirAsia India to fly international routes.AirAsia India has refuted the allegations of wrongdoing.New Delhi: AirAsia India is close to appointing an executive from Tata Steel Ltd to head the troubled low-cost carrier as its local partner, Tata Sons, moves to take greater control of the company, two sources aware of the matter told Reuters on Wednesday. Sunil Bhaskaran, who is currently vice president of corporate affairs at Tata Steel, has been chosen to head the airline - a joint venture between India's autos-to-steel conglomerate Tata Sons and Malaysian low-cost carrier AirAsia Group Bhd.AirAsia India did not immediately respond to a request for comment. Bhaskaran could not immediately be reached.AirAsia India has seen several high-profile exits in recent months and has been without a CEO for nearly six months. Bhaskaran's appointment would also come at a time when the airline and some of its executives are being investigated for alleged wrongdoing.Indian police in May filed a case against AirAsia Group, CEO Tony Fernandes and its domestic entity AirAsia India, over allegations of corruption and breaking rules in obtaining a flying licence.googletag.cmd.push(function() { googletag.display(""adslotNativeVideo""); });The Central Bureau of Investigation (CBI) accused the airline, some of its employees and third parties of violating India's foreign direct investment rules while obtaining the licence, and of allegedly bribing government officials in an attempt to get regulations relaxed to allow AirAsia India to fly international routes.AirAsia India has refuted the allegations of wrongdoing.© Thomson Reuters 2018Get the latest election news, live updates and election schedule for Lok Sabha Elections 2019 on ndtv.com/elections. Like us on Facebook or follow us on Twitter and Instagram for updates from each of the 543 parliamentary seats for the 2019 Indian general elections.",https://www.ndtv.com/business/airasia-india-may-appoint-tata-steel-executive-sunil-bhaskaran-as-new-ceo-report-1929874
