date,data,url
2018-05-18,"Merely three days after the National Company Law Tribunal (NCLT) approved the Tata Steel's debt resolution plan for acquiring the controlling stake of Bhushan Steel Limited (BSL), the Tata Group announced-in a stock market filing-that it has completed the acquisition. Tata Steel will acquire 72.65% shares comprising of 79 crore shares of face value Rs 2 each. The company further announced, in the stock market filing, that the acquisition provides an inorganic growth opportunity to Tata Steel to grow in its existing line of business in flat products and leverage operating synergies.Tata Steelfurther asserted that all necessary approvals such as that of Competition Commission of India and NCLT have been received. The consideration has been completed and the amount was in form of cash.Also Read: Tribunal Admits Ericsson's Insolvency Plea Against Reliance CommunicationsSettlements of the amounts equivalent to Rs 35,200 crore towards financial creditors of Bhushan Steel is being undertaken as per the terms of resolution plan as approved by the NCLTon May 15, announced Tata Steel on Friday.googletag.cmd.push(function() { googletag.display(""adslotNativeVideo""); });Also Read: Tata Steel Emerges As Top Bidder For Bhushan SteelBhushan Steel is a listed entity having a crude steel capacity of around 5.6 million tons along with downstream facilities of cold rolled products of around 2 mtpa. The company has its upstream facilities in Meramandali, Odisha and downstream facilities in Khopoli, Maharashtra and Sahibabad, Uttar Pradesh. The turnover for Fiscal 2017 is Rs 15,099 crore. The company was admitted under Corporate Insolvency Resolution Process on July 26, 2017 as per the Insolvency and Bankruptcy Code, 2016.Get the latest election news, live updates and election schedule for Lok Sabha Elections 2019 on ndtv.com/elections. Like us on Facebook or follow us on Twitter and Instagram for updates from each of the 543 parliamentary seats for the 2019 Indian general elections.",https://www.ndtv.com/business/tata-steel-completes-bhushan-steel-acquisition-three-days-after-nclt-approves-debt-resolution-plan-1854136
2018-05-19,"As Tata Steel's subsidiary Bamnipal Steel Ltd acquired Bhushan Steel on Friday, Union Finance Minister Piyush Goyal (who recently took the finance ministry's charge from Arun Jaitley in wake of the latter's ill health) described it as a ""historic breakthrough"" in resolving legacy issues of banks. The purchase is set to help the banks recover NPAs amounting to over Rs 36,000 crore in the time to come. Piyush Goyal said, ""Liquidation value of Bhushan Steel was Rs 14,541 crore but creditors received almost 4 times the amount (Rs 36,400). This was possible due to the robust and transparent Insolvency & Bankruptcy Code brought by this Government.""A Tata Steel press release on Friday stated that settlement of the amounts equivalent to Rs 35,200 crore towards financial creditors of Bhushan Steel is being undertaken as per the terms of the resolution plan. Rs 1,200 crore will be paid to the operational creditors of Bhushan Steel over a period of 12 months as per their limited claims. So, overall, the creditors stand to receive Rs 36,400 crore as per the debt resolution plan. Also Read: Tata Steel Acquires 72% Stake In Bankrupt Bhushan SteelFurther congratulating to Prime Minister Narendra Modi and Arun Jaitley for a ""historic breakthrough in resolving legacy issues of banks"", Goyal said that lenders (banks) recovered almost entire principal loan of Bhushan Steel through Rs 36,400 crore transparent bid by Tata Steel and also got 12% stake in the company.""For the first time such a large loan resolution has been achieved through upfront payment received by Banks through sale of a company. This is a record step towards resolving the legacy of unprecedented amount of bad bank loans inherited by this Government,"" said Goyal.Goyal asserts, in his twitter handle, that the NPA resolution process is being done through a fair and transparent Insolvency & Bankruptcy Code (which is) helping boost both the banking sector & the economy. This has been recognised by International Credit Rating Agencies as well.googletag.cmd.push(function() { googletag.display(""adslotNativeVideo""); });Also Read: Tata Steel Posts Q4 Profit At Rs. 14,688 CroreWith recovery of NPAs, said Goyal, banks will now be in a position to offer more and affordable credit to major sectors of the economy especially the MSME sector. This will boost employment & the economy even more, wrote Goyal.Not only Goyal, even Rajeev Kumar, secretary department of financial services, called the day as ""historic"" since the banks recover Rs 32,500 crore from the sale of Bhushan Steel to Tatas under the Insolvency and Bankruptcy Code. Banks will gain from write back,"" he wrote on his unconfirmed twitter handle. He further added that 53 lenders, domestic and international, stand to recover Rs 35,200 crores which is 76% of the outstanding bad debt. Mr Kumar said that the whole process got completed in 270 days from admission in NCLT. Creditors to also get upside from 12% equity stake now in strong hands.The Tata Steel press release states that the investment from Tata Steel's subsidiary Bamnipal Steel (BNPL) in Bhushan Steel has been done through a combination of equity of Rs 158.89 crore and inter corporate loans of Rs 34,973.69 crore. Additionally, Rs 100 crore has been paid by BNPL to the financial creditors of Bhushan Steel as consideration for novation of remaining financial debt of Bhushan Steel. The deal is being financed through a combination of external bridge loan of Rs 16,500 crore availed by BNPL and balance amount through investment by Tata Steel in BNPL. The bridge loan availed by BNPL is expected to be replaced by debt raised by Bhushan Steel over time. Get the latest election news, live updates and election schedule for Lok Sabha Elections 2019 on ndtv.com/elections. Like us on Facebook or follow us on Twitter and Instagram for updates from each of the 543 parliamentary seats for the 2019 Indian general elections.",https://www.ndtv.com/business/bhushan-steel-acquisition-by-tata-steel-fm-piyush-goyal-calls-it-historic-breakthrough-1854197
2018-06-29,"Indian stock markets opened on a positive note on the week's last session on fresh buying by investors as the July derivatives contracts started on a strong note amid recovery in the rupee, reported Press Trust of India. At 1.11, Sensex traded 293 points higher at 35,331. The NSE's Nifty rose 95 points, or 0.9 percent, to trade at 10,685. Brokers said building up of bets following the beginning of the July futures and options (F&O) series coupled with a firming trend at other Asian markets and overnight gains at Wall Street influenced trading sentiment here. Besides, the rupee recovering from its record low and easing crude oil prices supported the recovery, they added, PTI reported.Asian share markets rallied from nine-month lows on Friday, after China eased foreign investment limits, but underlying sentiment was dampened by worries over trade frictions a week before initial U.S. and Chinese tariffs were set to take effect.MSCI's broadest index of Asia-Pacific shares outside Japan was 1 percent higher, while Australian shares were flat.Japan's Nikkei stock index was down 0.3 percent, and South Korea's KOSPI was down slightly.After falling to fresh two-year lows on Thursday, shares in China rebounded Friday. While analysts said the jump reflected technical factors, it was helped by news that Beijing would ease foreign investment curbs on sectors including banking, automobiles, heavy industry and agriculture.Indian stock markets opened on a positive note on the week's last session on fresh buying by investors as the July derivatives contracts started on a strong note amid recovery in the rupee, reported Press Trust of India. At 1.11, Sensex traded 293 points higher at 35,331. The NSE's Nifty rose 95 points, or 0.9 percent, to trade at 10,685. Brokers said building up of bets following the beginning of the July futures and options (F&O) series coupled with a firming trend at other Asian markets and overnight gains at Wall Street influenced trading sentiment here. Besides, the rupee recovering from its record low and easing crude oil prices supported the recovery, they added, PTI reported.The top gainers among sensex stocks were Tata Steel (2.36 percent), ONGC (2.11 percent) and State Bank of India (SBI: 2.36 percent). Among sectoral indices, BSE oil & gas rose 1.92 percent and BSE metal jumped 2 percent. The major laggards were Axis Bank (0.91 percent), Mahindra & Mahindra (0.9 percent) and IndusInd Bank (1.11 percent).On Thursday, INR hit its all-time lowon rising crude oil prices and other reasons. However, the rupee recovered in the opening trade on Friday, while the government assured enough firepower of foreign exchange reserves to battle with rupee's decline.Asian share markets rallied from nine-month lows on Friday, after China eased foreign investment limits, but underlying sentiment was dampened by worries over trade frictions a week before initial U.S. and Chinese tariffs were set to take effect.MSCI's broadest index of Asia-Pacific shares outside Japan was 1 percent higher, while Australian shares were flat.Japan's Nikkei stock index was down 0.3 percent, and South Korea's KOSPI was down slightly.After falling to fresh two-year lows on Thursday, shares in China rebounded Friday. While analysts said the jump reflected technical factors, it was helped by news that Beijing would ease foreign investment curbs on sectors including banking, automobiles, heavy industry and agriculture.googletag.cmd.push(function() { googletag.display(""adslotNativeVideo""); });Get the latest election news, live updates and election schedule for Lok Sabha Elections 2019 on ndtv.com/elections. Like us on Facebook or follow us on Twitter and Instagram for updates from each of the 543 parliamentary seats for the 2019 Indian general elections.",https://www.ndtv.com/business/share-market-live-sensex-rises-300-points-nifty-above-10680-ril-tata-steel-top-gainers-1875063
2018-06-30,"Based in the Netherlands, it will be the continent's second-largest steelmaker after ArcelorMittal. It forms the core of Thyssenkrupp CEO Heinrich Hiesinger's plan to turn his steel-to-submarines conglomerate into a technology company.""The joint venture not only addresses the challenges of the European steel industry,"" Hiesinger said. ""It is the only solution to create significant additional value of around 5 billion euros for both Thyssenkrupp and Tata Steel due to joint synergies which cannot be realized in a stand-alone scenario.""The deal comes as European steel makers face tariffs of 25 per cent on their exports to the United States, their biggest market. That might force local market to absorb more volume as a result.Since the tariffs were announced in late May, shares in European steelmakers ArcelorMittal, Thyssenkrupp, Salzgitter and Voestalpine have lost 8 to 17 per cent.FRESH TERMSThyssenkrupp said the deal included ""proper compensation"" for the gap, which it said was in the mid-triple-digit million- euro range: if the joint venture makes a widely expected initial public offering it would get a bigger share of the proceeds.The German group also said it now expects annual synergies of 400 million to 500 million euros from the transaction. It said additional synergies were possible through managing capital expenditure and optimising working capital.Tata Steel will remain liable for environmental risks in Britain, where its Port Talbot factory, the least profitable of the joint venture, is based, said Markus Grolms, vice chairman of Thyssenkrupp's supervisory board.""Yes, we do want to protect people. But we also want a company with better chances and less risks,"" Grolms said.Thyssenkrupp's management will present a refined strategy to its supervisory board in the second week of July. Sources said that may include a sale of its Materials Services unit and further cost cuts.FRANKFURT/DUESSELDORF: Germany's Thyssenkrupp and Tata Steel signed a final agreement on Saturday to establish a long-expected steel joint venture, the European steel industry's biggest shake-up in more than a decade. The final agreement comes after months of negotiations since an initial agreement was announced in September. Both companies hope it will help them respond to challenges in the volatile steel industry, including overcapacity. The largest deal in Europe's steel industry since the takeover of Arcelor by Mittal in 2006, the 50-50 joint venture - to be named Thyssenkrupp Tata Steel - will have about 48,000 workers and about 17 billion euros ($19.9 billion) in sales.Based in the Netherlands, it will be the continent's second-largest steelmaker after ArcelorMittal. It forms the core of Thyssenkrupp CEO Heinrich Hiesinger's plan to turn his steel-to-submarines conglomerate into a technology company.""The joint venture not only addresses the challenges of the European steel industry,"" Hiesinger said. ""It is the only solution to create significant additional value of around 5 billion euros for both Thyssenkrupp and Tata Steel due to joint synergies which cannot be realized in a stand-alone scenario.""Tata Steel Chairman Natarajan Chandrasekaran, in a separate statement, said the joint venture will create ""a strong pan-European steel company that is structurally robust and competitive"".(Also Read: Tata Steel Acquires 72% Stake In Bankrupt Bhushan Steel)The deal comes as European steel makers face tariffs of 25 per cent on their exports to the United States, their biggest market. That might force local market to absorb more volume as a result.Since the tariffs were announced in late May, shares in European steelmakers ArcelorMittal, Thyssenkrupp, Salzgitter and Voestalpine have lost 8 to 17 per cent.FRESH TERMSHiesinger had faced pressure from activist shareholders Cevian and Elliott to extract more commitments from Tata Steel, whose European business has performed worse than Thyssen's since the agreement was first announced, creating a valuation gap.Thyssenkrupp said the deal included ""proper compensation"" for the gap, which it said was in the mid-triple-digit million- euro range: if the joint venture makes a widely expected initial public offering it would get a bigger share of the proceeds.Thyssenkrupp said it also secured the right to decide when a listing might take place, adding the joint venture was aiming for a dividend payout in the low-to-mid-triple-digit million- euro range.The German group also said it now expects annual synergies of 400 million to 500 million euros from the transaction. It said additional synergies were possible through managing capital expenditure and optimising working capital.Tata Steel will remain liable for environmental risks in Britain, where its Port Talbot factory, the least profitable of the joint venture, is based, said Markus Grolms, vice chairman of Thyssenkrupp's supervisory board.He also said that Tata Steel's Dutch unit would be part of the joint venture's cash-pooling mechanism. That had been a key demand for German workers concerned that Tata would give its own workers better conditions in the new company.""Yes, we do want to protect people. But we also want a company with better chances and less risks,"" Grolms said.Thyssenkrupp's management will present a refined strategy to its supervisory board in the second week of July. Sources said that may include a sale of its Materials Services unit and further cost cuts. © Thomson Reuters 2018(Except for the headline, this story has not been edited by NDTV staff and is published from a syndicated feed.)googletag.cmd.push(function() { googletag.display(""adslotNativeVideo""); });Get the latest election news, live updates and election schedule for Lok Sabha Elections 2019 on ndtv.com/elections. Like us on Facebook or follow us on Twitter and Instagram for updates from each of the 543 parliamentary seats for the 2019 Indian general elections.",https://www.ndtv.com/business/tata-steel-thyssenkrupp-finalise-landmark-steel-deal-1875739
2018-07-06,"A joint understanding of Board and Supervisory Board on the strategic direction of a company is a key pre-requisite for successfully leading a company, he said. He added: ""The joint venture of our steel activities with Tata is the next significant step to turn Thyssenkrupp into a strong industrial company. We can be proud of what we achieved until now. ""For this I would like to thank all employees.They are the most valuable capital of Thyssenkrupp."" Tata Steel's 50-50 joint venture with Germany's Thyssenkrupp has created Europe's second-largest steel company after Lakshmi Mittal's ArcelorMittal.The JV combines the European steel businesses of the Indian steel major with the German firm to create Thyssenkrupp Tata Steel BV. The new steel company will have a total workforce of 48,000 employees spread across 34 sites.  Prof Ulrich Lehner, chairman of the supervisory board, praised the outgoing CEO and said that the Board, under the leadership of Hiesinger, has freed Thyssenkrupp from an ""existential crisis"" and made the company ready for the future by implementing the strategy which was agreed by the Supervisory Board.""Without Heinrich Hiesinger there would be no Thyssenkrupp today. I am deeply grateful for what he achieved and especially for how he achieved this: intelligent, modest, consistent; with far-sightedness and social responsibility and always in the interest of our customers, employees and shareholders,"" he said.The company's supervisory board will meet on Friday to discuss and decide on the request of Heinrich Hiesinger, Thyssenkrupp said.London: German industrial giant Thyssenkrupp's CEO announced his resignation, just days after he hailed the ""historic"" merger of the company's steelmaking business with Tata Steel. In a move that came as a surprise, the company announced that Heinrich Hiesinger has asked the Supervisory Board of the company to end his mandate as chief executive officer of Thyssenkrupp AG ""in mutual agreement"".  Hiesinger said: ""Today I informed the Supervisory Board that I would like to step down from my position as CEO of Thyssenkrupp. I take this step very consciously to enable a fundamental discussion in the Supervisory Board on the future of Thyssenkrupp.""A joint understanding of Board and Supervisory Board on the strategic direction of a company is a key pre-requisite for successfully leading a company, he said. He added: ""The joint venture of our steel activities with Tata is the next significant step to turn Thyssenkrupp into a strong industrial company. We can be proud of what we achieved until now. ""For this I would like to thank all employees.They are the most valuable capital of Thyssenkrupp."" Tata Steel's 50-50 joint venture with Germany's Thyssenkrupp has created Europe's second-largest steel company after Lakshmi Mittal's ArcelorMittal.The JV combines the European steel businesses of the Indian steel major with the German firm to create Thyssenkrupp Tata Steel BV. The new steel company will have a total workforce of 48,000 employees spread across 34 sites.  Prof Ulrich Lehner, chairman of the supervisory board, praised the outgoing CEO and said that the Board, under the leadership of Hiesinger, has freed Thyssenkrupp from an ""existential crisis"" and made the company ready for the future by implementing the strategy which was agreed by the Supervisory Board.""Without Heinrich Hiesinger there would be no Thyssenkrupp today. I am deeply grateful for what he achieved and especially for how he achieved this: intelligent, modest, consistent; with far-sightedness and social responsibility and always in the interest of our customers, employees and shareholders,"" he said.The company's supervisory board will meet on Friday to discuss and decide on the request of Heinrich Hiesinger, Thyssenkrupp said.(This story has not been edited by NDTV staff and is auto-generated from a syndicated feed.)googletag.cmd.push(function() { googletag.display(""adslotNativeVideo""); });Get the latest election news, live updates and election schedule for Lok Sabha Elections 2019 on ndtv.com/elections. Like us on Facebook or follow us on Twitter and Instagram for updates from each of the 543 parliamentary seats for the 2019 Indian general elections.",https://www.ndtv.com/business/thyssenkrupp-ceo-heinrich-hiesinger-resigns-after-tata-steel-merger-1878742
2018-07-06,"Meanwhile, foreign portfolio investors (FPIs) sold shares worth Rs 159.37 crore on a net basis, while domestic institutional investors (DIIs) offloaded equities to the tune of Rs 296.97 crore on Thursday, provisional data showed, reported Press Trust of India. US stocks settled higher on Thursday, in a broad rally that was led by the technology sector. The minutes from the US Federal Reserve June policy meeting were in line with market expectations for further interest rate increases this yearFaltering Chinese markets dented Asian stocks in a choppy Friday morning, just hours before Washington is set to impose tariffs on Chinese imports that many investors fear might trigger a full-scale trade war in a blow to the global economy. Around 7.45 am, MSCI's broadest index of Asia-Pacific shares outside Japan was 0.3 percent lower, pulling back from a modest early rise. The index has lost 8.8 percent since June 7.Indian domestic market indices opened lower today before they posted gains during the day. At 2.30 pm, Sensex traded 204 points, or 0.58 percent higher to trade at 35,779 level, while NSE's Nifty50 traded at 10,804 level, 54 points, or 0.5 percent higher against the Thursday's closing. The top Sensex gainers in the afternoon trade included Hero MotoCorp (4.36 percent), Tata Motors (3.9 percent) and Bajaj Auto (2.13 percent). Among the Nifty stocks, the top gainers are HPCL, Hero MotoCorp and Tata Motors that jumped to the tune of 5 percent, 4.17 percent and 3.79 percent, respectively. Among sectoral indices, Nifty Realty, Nifty Auto and Nifty Metal indices posted the maximum gains to the tune of 1.72 percent, 1.48 percent and 1.27 percent, respectively. Today marked the listing of Varroc Engineering whose shares opened 6.7 percent higher on the market debut on BSE.Meanwhile, foreign portfolio investors (FPIs) sold shares worth Rs 159.37 crore on a net basis, while domestic institutional investors (DIIs) offloaded equities to the tune of Rs 296.97 crore on Thursday, provisional data showed, reported Press Trust of India. US stocks settled higher on Thursday, in a broad rally that was led by the technology sector. The minutes from the US Federal Reserve June policy meeting were in line with market expectations for further interest rate increases this yearThe Indian rupee on Friday fell by 8 paise to again breach the 69-mark to trade at 69.03 against the US dollar in opening trade. The fresh fall in Indian rupee is because of US dollar's appreciation and sustained foreign capital outflows. According to the forex dealers, the rupee's third straight slide happened due to demand for the US currency and a lower opening in the domestic equity market in morning trade today.Faltering Chinese markets dented Asian stocks in a choppy Friday morning, just hours before Washington is set to impose tariffs on Chinese imports that many investors fear might trigger a full-scale trade war in a blow to the global economy. Around 7.45 am, MSCI's broadest index of Asia-Pacific shares outside Japan was 0.3 percent lower, pulling back from a modest early rise. The index has lost 8.8 percent since June 7.Seoul's Kospi index fell 0.2 percent and shares in Taiwan were 0.4 percent lower. Australian shares were up 0.4 percent. China's major indexes were choppy in early trade, with the blue-chip CSI300 index in and out of negative territory. It was last 0.2 percent lower, while the Shanghai Composite index fell 0.3 percent. Japan's Nikkei stock index was 0.7 percent higher after closing at a three-month low on Thursday (with Reuters inputs)googletag.cmd.push(function() { googletag.display(""adslotNativeVideo""); });Get the latest election news, live updates and election schedule for Lok Sabha Elections 2019 on ndtv.com/elections. Like us on Facebook or follow us on Twitter and Instagram for updates from each of the 543 parliamentary seats for the 2019 Indian general elections.",https://www.ndtv.com/business/stock-market-live-updates-sensex-opens-lower-nifty-below-10-750-tata-steel-shares-opening-bell-1878768
