date,data,url
2018-10-30,"Bosses hoped the deal, more than two years in the making, would result in 400-500 million euros ($470-590 million) a year in savings, but the merger has caught the eye of competition officials in Brussels.""The European Commission has opened an in-depth investigation to assess the proposed creation of a joint venture by Tata Steel and ThyssenKrupp,"" the European Commission, the bloc's executive arm, said in a statement.""At this stage, the commission is concerned that the merger may reduce competition in the supply of various high-end steels.""An initial investigation raised possible problems over competition in the supply of certain specialised types of steel, including certain types used for cars, food packaging and engineering products such as electrical transformers.""At this stage, the commission is concerned that, following the transaction, customers would face a reduced choice in suppliers, as well as higher prices,"" the commission said.Customers in this case include various European businesses, ranging from small firms to major corporations.""Industries dependent on steel employ over 30 million people in Europe and we must be able to compete in global markets,"" the EU's competition commissioner Margrethe Vestager said.""This is why we will carefully investigate the impact of the planned combination of Tata Steel's and ThyssenKrupp's steel businesses on effective competition in the steel markets.""The merged firm, to be called ""Thyssenkrupp Tata Steel"", would be based in the Netherlands and boast 48,000 employees spread around 34 sites, producing around 21 million tonnes of steel per year for revenues of around 15 billion euros.Brussels, Belgium: HighlightsEuropean Union launches in-depth probe into proposed mega joint ventureTata Steel-ThyssenKrupp merger could reduce competition, say officialsMerged entity set to become Europe's second biggest steel manufacturerwindow._pricee = window._pricee || []; _pricee.push({container : '_pcwgtmid'});The European Union on Tuesday launched an in-depth probe into the proposed creation of a joint venture between Tata Steel and Germany's ThyssenKrupp, saying it could reduce competition.ThyssenKrupp struck a deal in June to merge its steel-making business with Tata in response to a flood of cheap Chinese steel unbalancing world markets, with the new venture set to become Europe's second biggest manufacturer of the metal.Bosses hoped the deal, more than two years in the making, would result in 400-500 million euros ($470-590 million) a year in savings, but the merger has caught the eye of competition officials in Brussels.""The European Commission has opened an in-depth investigation to assess the proposed creation of a joint venture by Tata Steel and ThyssenKrupp,"" the European Commission, the bloc's executive arm, said in a statement.""At this stage, the commission is concerned that the merger may reduce competition in the supply of various high-end steels.""An initial investigation raised possible problems over competition in the supply of certain specialised types of steel, including certain types used for cars, food packaging and engineering products such as electrical transformers.googletag.cmd.push(function() { googletag.display(""adslotNativeVideo""); });""At this stage, the commission is concerned that, following the transaction, customers would face a reduced choice in suppliers, as well as higher prices,"" the commission said.Customers in this case include various European businesses, ranging from small firms to major corporations.""Industries dependent on steel employ over 30 million people in Europe and we must be able to compete in global markets,"" the EU's competition commissioner Margrethe Vestager said.""This is why we will carefully investigate the impact of the planned combination of Tata Steel's and ThyssenKrupp's steel businesses on effective competition in the steel markets.""The merged firm, to be called ""Thyssenkrupp Tata Steel"", would be based in the Netherlands and boast 48,000 employees spread around 34 sites, producing around 21 million tonnes of steel per year for revenues of around 15 billion euros.Get the latest election news, live updates and election schedule for Lok Sabha Elections 2019 on ndtv.com/elections. Like us on Facebook or follow us on Twitter and Instagram for updates from each of the 543 parliamentary seats for the 2019 Indian general elections.",https://www.ndtv.com/business/probe-launched-into-tata-steel-merger-with-germanys-thyssenkrupp-1940232
2018-11-09,"A senior executive of Tata Steel Processing and Distribution Ltd was shot dead at the company's warehouse in Faridabad this afternoon, allegedly by a former employee. Arindam Pal, senior manager (supply chain) at the Tata Steel warehouse, was shot five times from close range.The accused, a former employee who was laid off in August, entered the company warehouse, located at Bata Chowk, about 10 kilometres from the city's border with New Delhi, claiming he wanted to settle his final dues, police said.""Accused Vishwash Pandey directly entered the cabin of Arindam Pal and shot him five times,"" police said.Vishwash Pandey, 32, then escaped from the rear gate of the warehouse of Tata Steel Processing and Distribution Ltd, a subsidiary of Tata Steel.Arindam Pal was rushed to a local hospital, but was declared dead on arrival.""After he was shot, he was taken to the hospital by his colleagues. He died while he was being taken to the hospital,"" a police official said.""After initial checkup the doctor said that he was shot five times, however, the details will be clear after the post-mortem,"" he added.A statement by Tata Steel said Mr Pal is survived by his wife, parents and a daughter.""The local police are investigating the law and order incident and an FIR is being filed. The company extends its condolences to the family of Mr Pal and is extending all possible support and help to the family at this time of crisis,"" the statement said.Faridabad: HighlightsArindam Pal was shot five times from close rangeThe accused, Vishwash Pandey, 32, was laid off in AugustHe then escaped from the rear gate of the warehousewindow._pricee = window._pricee || []; _pricee.push({container : '_pcwgtmid'});A senior executive of Tata Steel Processing and Distribution Ltd was shot dead at the company's warehouse in Faridabad this afternoon, allegedly by a former employee. Arindam Pal, senior manager (supply chain) at the Tata Steel warehouse, was shot five times from close range.The accused, a former employee who was laid off in August, entered the company warehouse, located at Bata Chowk, about 10 kilometres from the city's border with New Delhi, claiming he wanted to settle his final dues, police said.""Accused Vishwash Pandey directly entered the cabin of Arindam Pal and shot him five times,"" police said.Vishwash Pandey, 32, then escaped from the rear gate of the warehouse of Tata Steel Processing and Distribution Ltd, a subsidiary of Tata Steel.Arindam Pal was rushed to a local hospital, but was declared dead on arrival.googletag.cmd.push(function() { googletag.display(""adslotNativeVideo""); });""After he was shot, he was taken to the hospital by his colleagues. He died while he was being taken to the hospital,"" a police official said. ""After initial checkup the doctor said that he was shot five times, however, the details will be clear after the post-mortem,"" he added.A statement by Tata Steel said Mr Pal is survived by his wife, parents and a daughter.""The local police are investigating the law and order incident and an FIR is being filed. The company extends its condolences to the family of Mr Pal and is extending all possible support and help to the family at this time of crisis,"" the statement said.Get the latest election news, live updates and election schedule for Lok Sabha Elections 2019 on ndtv.com/elections. Like us on Facebook or follow us on Twitter and Instagram for updates from each of the 543 parliamentary seats for the 2019 Indian general elections.",https://www.ndtv.com/cities/tata-steel-manager-shot-dead-in-faridabad-allegedly-by-former-employee-1945077
2018-11-10,"டாட்டா ஸ்டீல் நிறுவனத்தின் மூத்த நிர்வாகி கம்பெனி கிடங்கில் முன்னாள் ஊழியரால் சுட்டுக் கொள்ளப்பட்டார். நிர்வாகி அரின்தம் பால் ஐந்து முறை துப்பாக்கியால் சுடப்பட்டார்.கடந்த ஐந்து மாதங்களுக்கு முன்பு பணியிலிருந்து சென்ற முன்னாள் ஊழியர், பரிதாபாத்தில் உள்ள கம்பெனி கிடங்கில் நுழைந்து தான் பணிபுரிந்தற்காக வழங்கப்பட வேண்டிய இறுதி பணத்தொகையை கேட்டுள்ளார் என்று போலீசார் கூறியுள்ளனர்.முன்னாள் ஊழியர் விஷ்வாஸ் பாண்டே அரின்தம் பால் இருக்கும் பகுதிக்குள் நுழைந்து அவரை ஐந்து முறை துப்பாக்கியால் சுட்டார் என்று போலீசார் தெரிவித்தனர். பின் விஷ்வாஸ் பாண்டே பின்பக்கம் வழியாக தப்பித்து சென்றுள்ளார்.துப்பாக்கியால் சுடப்பட்ட அரின்தம் பாலை அங்கிருந்தவர்கள் உடனடியாக மருத்துவமனைக்கு கொண்டு சென்றனர். இருப்பினும் வழியிலேயே அவர் உயிர் பிரிந்ததாக மருத்துவர்கள் தெரிவித்தனர்.Faridabad: டாட்டா ஸ்டீல் நிறுவனத்தின் மூத்த நிர்வாகி கம்பெனி கிடங்கில் முன்னாள் ஊழியரால் சுட்டுக் கொள்ளப்பட்டார். நிர்வாகி அரின்தம் பால் ஐந்து முறை துப்பாக்கியால் சுடப்பட்டார். கடந்த ஐந்து மாதங்களுக்கு முன்பு பணியிலிருந்து சென்ற முன்னாள் ஊழியர், பரிதாபாத்தில் உள்ள கம்பெனி கிடங்கில் நுழைந்து தான் பணிபுரிந்தற்காக வழங்கப்பட வேண்டிய இறுதி பணத்தொகையை கேட்டுள்ளார் என்று போலீசார் கூறியுள்ளனர். முன்னாள் ஊழியர் விஷ்வாஸ் பாண்டே அரின்தம் பால் இருக்கும் பகுதிக்குள் நுழைந்து அவரை ஐந்து முறை துப்பாக்கியால் சுட்டார் என்று போலீசார் தெரிவித்தனர். பின் விஷ்வாஸ் பாண்டே பின்பக்கம் வழியாக தப்பித்து சென்றுள்ளார். googletag.cmd.push(function() { googletag.display(""adslotNativeVideo""); });துப்பாக்கியால் சுடப்பட்ட அரின்தம் பாலை அங்கிருந்தவர்கள் உடனடியாக மருத்துவமனைக்கு கொண்டு சென்றனர். இருப்பினும் வழியிலேயே அவர் உயிர் பிரிந்ததாக மருத்துவர்கள் தெரிவித்தனர். சமீபத்திய தமிழ்நாட்டுச் செய்திகள், சென்னை செய்திகள், அரசியல், வர்த்தகம், தொழில்நுட்பம், கிரிக்கெட் ஆகியவற்றின் தலைப்புச் செய்திகள் என ஒவ்வொரு நிகழ்வுகளையும் பற்றி தமிழில் படிக்க பேஸ்புக் மற்றும் ட்விட்டர் NDTV Tamilஐ பின் தொடருங்கள்.",https://www.ndtv.com/tamil/tata-steel-manager-shot-dead-in-faridabad-allegedly-by-former-employee-1945136
2018-11-13,"Steelmaker Tata Steel net profit grew more than three-fold in second quarter, the company said on Tuesday, beating market estimates, buoyed by strong domestic growth. Net profit came in at Rs 3,116 crore ($428.79 million) in its fiscal second quarter ended September 30 from Rs 1,018 crore a year earlier, compared with an analysts estimate of Rs 2,247 crore, according to IBES data from Refinitiv. The Mumbai-based company posted a rise of 15 per cent in total steel deliveries in the quarter, of which India deliveries accounted for 58 per cent.""While we are positive on steel demand outlook especially in India, the risk of trade wars and increasing imports remains a concern,"" Chief Executive Officer T V Narendran said in a statement.Tata Steel India deliveries, which includes Tata Steel's standalone operations and Bhushan Steel , stood at 4.32 million tonnes. Total revenue from operations rose 34.1 per cent to Rs 43,544 crore.Tata Steel also remained optimistic about its joint venture with Germany's Thyssenkrupp AG, which they signed after more than two years of negotiation.""We are making good progress on the TSE (Tata Steel Europe) ThyssenKrupp JV,"" Narendran said.Last month, the European Commission said it was investigating whether a planned joint venture between the Indian steelmaker and ThyssenKrupp could reduce competition in the high-end steel sector.The completion of the deal is expected either in the fourth quarter of this year or in the first quarter of 2019, depending on antitrust talks with the European Commission.($1 = 72.6700 Indian rupees)Steelmaker Tata Steel net profit grew more than three-fold in second quarter, the company said on Tuesday, beating market estimates, buoyed by strong domestic growth. Net profit came in at Rs 3,116 crore ($428.79 million) in its fiscal second quarter ended September 30 from Rs 1,018 crore a year earlier, compared with an analysts estimate of Rs 2,247 crore, according to IBES data from Refinitiv. The Mumbai-based company posted a rise of 15 per cent in total steel deliveries in the quarter, of which India deliveries accounted for 58 per cent.""While we are positive on steel demand outlook especially in India, the risk of trade wars and increasing imports remains a concern,"" Chief Executive Officer T V Narendran said in a statement.Tata Steel India deliveries, which includes Tata Steel's standalone operations and Bhushan Steel , stood at 4.32 million tonnes. Total revenue from operations rose 34.1 per cent to Rs 43,544 crore.Tata Steel also remained optimistic about its joint venture with Germany's Thyssenkrupp AG, which they signed after more than two years of negotiation.""We are making good progress on the TSE (Tata Steel Europe) ThyssenKrupp JV,"" Narendran said.googletag.cmd.push(function() { googletag.display(""adslotNativeVideo""); });Last month, the European Commission said it was investigating whether a planned joint venture between the Indian steelmaker and ThyssenKrupp could reduce competition in the high-end steel sector.The completion of the deal is expected either in the fourth quarter of this year or in the first quarter of 2019, depending on antitrust talks with the European Commission.($1 = 72.6700 Indian rupees)Get the latest election news, live updates and election schedule for Lok Sabha Elections 2019 on ndtv.com/elections. Like us on Facebook or follow us on Twitter and Instagram for updates from each of the 543 parliamentary seats for the 2019 Indian general elections.",https://www.ndtv.com/business/tata-steel-posts-rs-3-116-crore-profit-in-second-quarter-beats-analysts-estimates-1946807
2018-11-14,"However, the companies said their customer relationships, array of value-added products and customisation would help them retain and grow market share and take on competition.""Obviously from Tata Steel point of view, we will continue to up the ante,"" TV Narendran, chief executive and managing director of Tata Steel said on Tuesday. ""We have the technology and the product lines that are required.""ArcelorMittal's entry comes at a time when Indian steel demand is growing at the fastest pace in the world. India is expected to overtake the United States in steel consumption in 2019 to become the second biggest market behind China, global steel body World Steel Association said in a report last month.ArcelorMittal plans to increase capacity of Essar's plant to 15 million tonnes from 10 million tonnes now, and produce higher grades of products. Owned by billionaire Lakshmi Mittal, ArcelorMittal is the world's biggest steel company with a total tonnage of 97.03 million tonnes in 2017.Analysts feel ArcelorMittal's foray will force major Indian steelmakers to innovate, despite them downplaying the impact.""ArcelorMittal's entry would spur a shift from steel capacity expansion to product/technology evolution by incumbents,"" said domestic broking firm Edelweiss in a report.Indian steelmakers say this is already in the works.""Each one of us in my view has enough space,"" Seshagiri Rao, joint managing director of JSW Steel, said on Tuesday, referring to India's growing steel market.Rao said in-line with global trends JSW had already started to move from ""volumes to value"" to secure its profitability and market share in the future.JSW Steel is spending up to Rs 6,000 crore to expand its value-added offerings like automotive steel, electrical steel, and galvanised products by over 60 per cent over the next three years, out of a total spend of Rs 45,000 crore on expansions.""We will completely transform JSW Steel ... and also align the company in-line with what the market demands,"" he said.MUMBAI: JSW Steel and Tata Steel, two largest private sector steel companies in the country, are banking on their diversified product mix to take on steel giant ArcelorMittal SA as it gears up to enter the market. In October, creditors of bankrupt Essar Steel approved a Rs 50,000 crore ($6.9 billion) joint offer by ArcelorMittal and Japan's Nippon Steel & Sumitomo Metal for Essar's assets, paving the way for the first major foreign bets on steel manufacturing in India.Both JSW Steel and Tata Steel, during separate meetings with media on Tuesday, said the entry of the global giant in the country's fast growing steel market would be good for competition.However, the companies said their customer relationships, array of value-added products and customisation would help them retain and grow market share and take on competition.""Obviously from Tata Steel point of view, we will continue to up the ante,"" TV Narendran, chief executive and managing director of Tata Steel said on Tuesday. ""We have the technology and the product lines that are required.""ArcelorMittal's entry comes at a time when Indian steel demand is growing at the fastest pace in the world. India is expected to overtake the United States in steel consumption in 2019 to become the second biggest market behind China, global steel body World Steel Association said in a report last month.ArcelorMittal plans to increase capacity of Essar's plant to 15 million tonnes from 10 million tonnes now, and produce higher grades of products. Owned by billionaire Lakshmi Mittal, ArcelorMittal is the world's biggest steel company with a total tonnage of 97.03 million tonnes in 2017.Analysts feel ArcelorMittal's foray will force major Indian steelmakers to innovate, despite them downplaying the impact.googletag.cmd.push(function() { googletag.display(""adslotNativeVideo""); });""ArcelorMittal's entry would spur a shift from steel capacity expansion to product/technology evolution by incumbents,"" said domestic broking firm Edelweiss in a report.Indian steelmakers say this is already in the works.""Each one of us in my view has enough space,"" Seshagiri Rao, joint managing director of JSW Steel, said on Tuesday, referring to India's growing steel market.Rao said in-line with global trends JSW had already started to move from ""volumes to value"" to secure its profitability and market share in the future.JSW Steel is spending up to Rs 6,000 crore to expand its value-added offerings like automotive steel, electrical steel, and galvanised products by over 60 per cent over the next three years, out of a total spend of Rs 45,000 crore on expansions.""We will completely transform JSW Steel ... and also align the company in-line with what the market demands,"" he said.(Except for the headline, this story has not been edited by NDTV staff and is published from a syndicated feed.)Get the latest election news, live updates and election schedule for Lok Sabha Elections 2019 on ndtv.com/elections. Like us on Facebook or follow us on Twitter and Instagram for updates from each of the 543 parliamentary seats for the 2019 Indian general elections.",https://www.ndtv.com/business/tata-steel-jsw-say-arcelormittal-entry-to-be-good-for-competition-1947422
