user,fullname,tweet-id,timestamp,url,likes,replies,retweets,text,html
alumninitjsr,Alumni NIT JSR,986311348987531269,2018-04-17 18:32:05,/alumninitjsr/status/986311348987531269,0,0,0,"Hello Alumni.
Greetings from Alumni Team, NIT Jamshedpur.
Any alumnus in TATA STEEL, TATA MOTORS, TATA CUMMINS or any other TATA GROUPS in jamshedpur, please help 6th semester students of NIT... https://www.facebook.com/story.php?story_fbid=2103746242972846&id=758206274193523 …","<p class=""TweetTextSize js-tweet-text tweet-text"" data-aria-label-part=""0"" lang=""en"">Hello Alumni.
Greetings from Alumni Team, NIT Jamshedpur.
Any alumnus in <strong>TATA STEEL</strong>, <strong>TATA</strong> MOTORS, <strong>TATA</strong> CUMMINS <strong>or</strong> any other <strong>TATA</strong> GROUPS in jamshedpur, please help 6th semester students of NIT... <a class=""twitter-timeline-link"" data-expanded-url=""https://www.facebook.com/story.php?story_fbid=2103746242972846&amp;id=758206274193523"" dir=""ltr"" href=""https://t.co/rWcBHGwy7v"" rel=""nofollow noopener"" target=""_blank"" title=""https://www.facebook.com/story.php?story_fbid=2103746242972846&amp;id=758206274193523""><span class=""tco-ellipsis""></span><span class=""invisible"">https://www.</span><span class=""js-display-url"">facebook.com/story.php?stor</span><span class=""invisible"">y_fbid=2103746242972846&amp;id=758206274193523</span><span class=""tco-ellipsis""><span class=""invisible""> </span>…</span></a></p>"
Mufadda84837392,Mufaddal,986163115703308288,2018-04-17 08:43:03,/Mufadda84837392/status/986163115703308288,0,0,0,Sir plz update on tata steel I have on 604 levels should sell or wait,"<p class=""TweetTextSize js-tweet-text tweet-text"" data-aria-label-part=""0"" lang=""en"">Sir plz update on <strong>tata steel</strong> I have on 604 levels should sell <strong>or</strong> wait</p>"
Dwarf_The_II,Swimming Dwarf II,984707240824328192,2018-04-13 08:17:55,/Dwarf_The_II/status/984707240824328192,0,0,0,"1. No reports on multilateral action with #EU and #British support. #Tata steel was hit hard a couple of years ago; you would find willing allies.
2.WTO route not explored or what?
3.What about the Chinese copycat cars? #BYD
4.COD :MW4-Trade Wars #Confirmed @Activisionhttps://twitter.com/marcorubio/status/984588686946897925 …","<p class=""TweetTextSize js-tweet-text tweet-text"" data-aria-label-part=""4"" lang=""en"">1. No reports on multilateral action with <a class=""twitter-hashtag pretty-link js-nav"" data-query-source=""hashtag_click"" dir=""ltr"" href=""/hashtag/EU?src=hash""><s>#</s><b>EU</b></a> and <a class=""twitter-hashtag pretty-link js-nav"" data-query-source=""hashtag_click"" dir=""ltr"" href=""/hashtag/British?src=hash""><s>#</s><b>British</b></a> support. <a class=""twitter-hashtag pretty-link js-nav"" data-query-source=""hashtag_click"" dir=""ltr"" href=""/hashtag/Tata?src=hash""><s>#</s><b><strong>Tata</strong></b></a> <strong>steel</strong> was hit hard a couple of years ago; you would find willing allies.
2.WTO route not explored <strong>or</strong> what?
3.What about the Chinese copycat cars? <a class=""twitter-hashtag pretty-link js-nav"" data-query-source=""hashtag_click"" dir=""ltr"" href=""/hashtag/BYD?src=hash""><s>#</s><b>BYD</b></a>
4.COD :MW4-Trade Wars <a class=""twitter-hashtag pretty-link js-nav"" data-query-source=""hashtag_click"" dir=""ltr"" href=""/hashtag/Confirmed?src=hash""><s>#</s><b>Confirmed</b></a> <a class=""twitter-atreply pretty-link js-nav"" data-mentioned-user-id=""612782611"" dir=""ltr"" href=""/Activision""><s>@</s><b>Activision</b></a><a class=""twitter-timeline-link u-hidden"" data-expanded-url=""https://twitter.com/marcorubio/status/984588686946897925"" dir=""ltr"" href=""https://t.co/D3RuWXqJ0a"" rel=""nofollow noopener"" target=""_blank"" title=""https://twitter.com/marcorubio/status/984588686946897925""><span class=""tco-ellipsis""></span><span class=""invisible"">https://</span><span class=""js-display-url"">twitter.com/marcorubio/sta</span><span class=""invisible"">tus/984588686946897925</span><span class=""tco-ellipsis""><span class=""invisible""> </span>…</span></a></p>"
abhijit_bajare,Abhijit Bajare,975188720415514625,2018-03-18 01:54:43,/abhijit_bajare/status/975188720415514625,0,0,0,@nitinbhatia121 sir may I hold or exit from Tata steel it's already down from 793 to 600 holding @ 495 . Please suggest your view,"<p class=""TweetTextSize js-tweet-text tweet-text"" data-aria-label-part=""0"" lang=""en""><a class=""twitter-atreply pretty-link js-nav"" data-mentioned-user-id=""521524062"" dir=""ltr"" href=""/nitinbhatia121""><s>@</s><b>nitinbhatia121</b></a> sir may I hold <strong>or</strong> exit from <strong>Tata steel</strong> it's already down from 793 to 600 holding @ 495 . Please suggest your view</p>"
Cadzo10,Rich Caddy,974001036154241029,2018-03-14 19:15:17,/Cadzo10/status/974001036154241029,0,2,0,My gut feeling is that a lot of advisers have been backed into a corner. The FCA will only consider a like for like transfer when carrying out assessments. Instead of the current situation or potential future modifications by Tata steel.,"<p class=""TweetTextSize js-tweet-text tweet-text"" data-aria-label-part=""0"" lang=""en"">My gut feeling is that a lot of advisers have been backed into a corner. The FCA will only consider a like for like transfer when carrying out assessments. Instead of the current situation <strong>or</strong> potential future modifications by <strong>Tata steel</strong>.</p>"
muralikumarje,Markets Today,973792416053460994,2018-03-14 05:26:18,/muralikumarje/status/973792416053460994,0,0,0,Sir Tata steel trading green... Long or short advisable?,"<p class=""TweetTextSize js-tweet-text tweet-text"" data-aria-label-part=""0"" lang=""en"">Sir <strong>Tata steel</strong> trading green... Long <strong>or</strong> short advisable?</p>"
MorganLeahy,Morgan Leahy,973594375212199942,2018-03-13 16:19:22,/MorganLeahy/status/973594375212199942,0,0,0,"Note Indian owned steel plants in U.K. Export £400m to US. That now £500m
Bad timing that Macron in India to offer solutions and access to #EU
Good option for Renault owned Nissan and Peugeot owned Vauxhall though. And Tata steel own Land Rover.
Or Le Land Rover ??","<p class=""TweetTextSize js-tweet-text tweet-text"" data-aria-label-part=""0"" lang=""en"">Note Indian owned <strong>steel</strong> plants in U.K. Export £400m to US. That now £500m
Bad timing that Macron in India to offer solutions and access to <a class=""twitter-hashtag pretty-link js-nav"" data-query-source=""hashtag_click"" dir=""ltr"" href=""/hashtag/EU?src=hash""><s>#</s><b>EU</b></a>
Good option for Renault owned Nissan and Peugeot owned Vauxhall though. And <strong>Tata steel</strong> own Land Rover.
<strong>Or</strong> Le Land Rover ??</p>"
rohanm6661,CS Rohan Mota,973561553084604416,2018-03-13 14:08:56,/rohanm6661/status/973561553084604416,0,1,0,Tht is not only to banks or nbfcs but all large corporates tata steel hdfc etc,"<p class=""TweetTextSize js-tweet-text tweet-text"" data-aria-label-part=""0"" lang=""en"">Tht is not only to banks <strong>or</strong> nbfcs but all large corporates <strong>tata steel</strong> hdfc etc</p>"
Clwyd_Jobs_UK,Clwyd Jobs,972422079709560832,2018-03-10 10:41:05,/Clwyd_Jobs_UK/status/972422079709560832,0,0,0,"#ClwydJobs #Clwyd #Jobs Fabricator / Welder, Deeside: We are looking to fill position of Fabricator / Welder or a Major Client (Tata Steel) at the Shotton Plant. Job Title: Engineering Fabricator / Welder… http://dlvr.it/QKTJCF  For More Jobs >>> Please Go2 Our Page!","<p class=""TweetTextSize js-tweet-text tweet-text"" data-aria-label-part=""0"" lang=""en""><a class=""twitter-hashtag pretty-link js-nav"" data-query-source=""hashtag_click"" dir=""ltr"" href=""/hashtag/ClwydJobs?src=hash""><s>#</s><b>ClwydJobs</b></a> <a class=""twitter-hashtag pretty-link js-nav"" data-query-source=""hashtag_click"" dir=""ltr"" href=""/hashtag/Clwyd?src=hash""><s>#</s><b>Clwyd</b></a> <a class=""twitter-hashtag pretty-link js-nav"" data-query-source=""hashtag_click"" dir=""ltr"" href=""/hashtag/Jobs?src=hash""><s>#</s><b>Jobs</b></a> Fabricator / Welder, Deeside: We are looking to fill position of Fabricator / Welder <strong>or</strong> a Major Client (<strong>Tata Steel</strong>) at the Shotton Plant. Job Title: Engineering Fabricator / Welder… <a class=""twitter-timeline-link"" data-expanded-url=""http://dlvr.it/QKTJCF"" dir=""ltr"" href=""https://t.co/FSNH8oTsHf"" rel=""nofollow noopener"" target=""_blank"" title=""http://dlvr.it/QKTJCF""><span class=""tco-ellipsis""></span><span class=""invisible"">http://</span><span class=""js-display-url"">dlvr.it/QKTJCF</span><span class=""invisible""></span><span class=""tco-ellipsis""><span class=""invisible""> </span></span></a> For More Jobs &gt;&gt;&gt; Please Go2 Our Page!</p>"
kndgrc,#KNDfrintegrity,972402540598902784,2018-03-10 09:23:26,/kndgrc/status/972402540598902784,0,0,0,"@dasraghubar Sir, This needs your kind attention. We are now democratic India, but in such ambiance it is the same or worse than of before freedom. You are from our Tata steel so you know the value of such kind of teachers having pathetic time. I am aSr Citizen ur ex friend pic.twitter.com/Dow7ZfF5Rp","<p class=""TweetTextSize js-tweet-text tweet-text"" data-aria-label-part=""0"" lang=""en""><a class=""twitter-atreply pretty-link js-nav"" data-mentioned-user-id=""3123339037"" dir=""ltr"" href=""/dasraghubar""><s>@</s><b>dasraghubar</b></a> Sir, This needs your kind attention. We are now democratic India, but in such ambiance it is the same <strong>or</strong> worse than of before freedom. You are from our <strong>Tata steel</strong> so you know the value of such kind of teachers having pathetic time. I am aSr Citizen ur ex friend <a class=""twitter-timeline-link u-hidden"" data-pre-embedded=""true"" dir=""ltr"" href=""https://t.co/Dow7ZfF5Rp"">pic.twitter.com/Dow7ZfF5Rp</a></p>"
surajd1973,Suraj Das,972029049466843136,2018-03-09 08:39:19,/surajd1973/status/972029049466843136,0,0,0,"Any ideas why is JSPL getting more hit than JSW Steel or Tata Steel? Down from almost 270 levels to current 228 levels. Any clarification would be greatly appreciated.
@Amit_Jeswani1","<p class=""TweetTextSize js-tweet-text tweet-text"" data-aria-label-part=""0"" lang=""en"">Any ideas why is JSPL getting more hit than JSW <strong>Steel</strong> <strong>or</strong> <strong>Tata Steel</strong>? Down from almost 270 levels to current 228 levels. Any clarification would be greatly appreciated.
<a class=""twitter-atreply pretty-link js-nav"" data-mentioned-user-id=""136100401"" dir=""ltr"" href=""/Amit_Jeswani1""><s>@</s><b>Amit_Jeswani1</b></a></p>"
surajd1973,Suraj Das,972021972451319808,2018-03-09 08:11:12,/surajd1973/status/972021972451319808,0,0,0,Any ideas why is JSPL getting more hit than JSW Steel or Tata Steel? Down from almost 270 levels to current 228 levels. Any clarification would be greatly appreciated.,"<p class=""TweetTextSize js-tweet-text tweet-text"" data-aria-label-part=""0"" lang=""en"">Any ideas why is JSPL getting more hit than JSW <strong>Steel</strong> <strong>or</strong> <strong>Tata Steel</strong>? Down from almost 270 levels to current 228 levels. Any clarification would be greatly appreciated.</p>"
RiteshGaggar,Ritesh,971931553864433664,2018-03-09 02:11:54,/RiteshGaggar/status/971931553864433664,0,0,0,"Fair, but these will be earnings/cashflow diluting for buyers like Edelweiss or Tata Steel. Will look again.","<p class=""TweetTextSize js-tweet-text tweet-text"" data-aria-label-part=""0"" lang=""en"">Fair, but these will be earnings/cashflow diluting for buyers like Edelweiss <strong>or</strong> <strong>Tata Steel</strong>. Will look again.</p>"
devadvisory9939,DEV,971727334674976768,2018-03-08 12:40:25,/devadvisory9939/status/971727334674976768,0,0,0,Apollo Tyres and Tata Chemicals worked out perfectly. Others either flat or slightly down. Tata Steel was a clear pass.,"<p class=""TweetTextSize js-tweet-text tweet-text"" data-aria-label-part=""0"" lang=""en"">Apollo Tyres and <strong>Tata</strong> Chemicals worked out perfectly. Others either flat <strong>or</strong> slightly down. <strong>Tata Steel</strong> was a clear pass.</p>"
rharisap,Hari,971431150148141056,2018-03-07 17:03:29,/rharisap/status/971431150148141056,0,0,0,So Tata steel will fall further or go up?,"<p class=""TweetTextSize js-tweet-text tweet-text"" data-aria-label-part=""0"" lang=""en"">So <strong>Tata steel</strong> will fall further <strong>or</strong> go up?</p>"
awesome_rajesh_,Rajesh,971408989085773824,2018-03-07 15:35:25,/awesome_rajesh_/status/971408989085773824,0,0,0,Sir upper circuit in Tata Steel or Bhushan Steel? I guess it has to be Bhushan Steel?,"<p class=""TweetTextSize js-tweet-text tweet-text"" data-aria-label-part=""0"" lang=""en"">Sir upper circuit in <strong>Tata Steel</strong> <strong>or</strong> Bhushan <strong>Steel</strong>? I guess it has to be Bhushan <strong>Steel</strong>?</p>"
hdevreij,Hans de Vreij,971351042225995776,2018-03-07 11:45:09,/hdevreij/status/971351042225995776,11,0,5,"The Dutch branch of Tata Steel exports tinned steel to the U.S. because somehow Americans can't make it themselves. Just like they can't produce Audi's, BMW's or other quality cars themselves (without importing entire European car factories). Conclusion: Third World workforce...","<p class=""TweetTextSize js-tweet-text tweet-text"" data-aria-label-part=""0"" lang=""en"">The Dutch branch of <strong>Tata Steel</strong> exports tinned <strong>steel</strong> to the U.S. because somehow Americans can't make it themselves. Just like they can't produce Audi's, BMW's <strong>or</strong> other quality cars themselves (without importing entire European car factories). Conclusion: Third World workforce...</p>"
RaghuramanMenon,Chowkidar Raghu,950975842104078336,2018-01-10 06:21:23,/RaghuramanMenon/status/950975842104078336,0,0,0,"I heard in 80's Tata Steel Jamshedpur had the plates and cups printed with "" This Plate or Cup Stolen From Tata Canteen"" https://twitter.com/muglikar_/status/950969019133284352 …","<p class=""TweetTextSize js-tweet-text tweet-text"" data-aria-label-part=""4"" lang=""en"">I heard in 80's <strong>Tata Steel</strong> Jamshedpur had the plates and cups printed with "" This Plate <strong>or</strong> Cup Stolen From <strong>Tata</strong> Canteen""<img alt=""😂"" aria-label=""Emoji: Face with tears of joy"" class=""Emoji Emoji--forText"" draggable=""false"" src=""https://abs.twimg.com/emoji/v2/72x72/1f602.png"" title=""Face with tears of joy""/> <a class=""twitter-timeline-link u-hidden"" data-expanded-url=""https://twitter.com/muglikar_/status/950969019133284352"" dir=""ltr"" href=""https://t.co/lGnylfVl7h"" rel=""nofollow noopener"" target=""_blank"" title=""https://twitter.com/muglikar_/status/950969019133284352""><span class=""tco-ellipsis""></span><span class=""invisible"">https://</span><span class=""js-display-url"">twitter.com/muglikar_/stat</span><span class=""invisible"">us/950969019133284352</span><span class=""tco-ellipsis""><span class=""invisible""> </span>…</span></a></p>"
HighPeakSteels,High Peak Steels,950702766908956674,2018-01-09 12:16:17,/HighPeakSteels/status/950702766908956674,0,0,0,"#steelbar #steelstockists Mobile canning concept to cut food loss developed by Tata Steel - A third of all food production worldwide is lost or wasted before it even reaches consumers including postharvest handling, storage, processing, packaging and ... http://ow.ly/LJv350g4fGd ","<p class=""TweetTextSize js-tweet-text tweet-text"" data-aria-label-part=""0"" lang=""en""><a class=""twitter-hashtag pretty-link js-nav"" data-query-source=""hashtag_click"" dir=""ltr"" href=""/hashtag/steelbar?src=hash""><s>#</s><b>steelbar</b></a> <a class=""twitter-hashtag pretty-link js-nav"" data-query-source=""hashtag_click"" dir=""ltr"" href=""/hashtag/steelstockists?src=hash""><s>#</s><b>steelstockists</b></a> Mobile canning concept to cut food loss developed by <strong>Tata Steel</strong> - A third of all food production worldwide is lost <strong>or</strong> wasted before it even reaches consumers including postharvest handling, storage, processing, packaging and ... <a class=""twitter-timeline-link"" data-expanded-url=""http://ow.ly/LJv350g4fGd"" dir=""ltr"" href=""https://t.co/CxU6437kBD"" rel=""nofollow noopener"" target=""_blank"" title=""http://ow.ly/LJv350g4fGd""><span class=""tco-ellipsis""></span><span class=""invisible"">http://</span><span class=""js-display-url"">ow.ly/LJv350g4fGd</span><span class=""invisible""></span><span class=""tco-ellipsis""><span class=""invisible""> </span></span></a></p>"
Vikingavfc,VillaViking,950441875105812480,2018-01-08 18:59:36,/Vikingavfc/status/950441875105812480,0,0,0,"What about Tata steel, can you tell me how the EU helped the steel workers?  What about all the unemployed around the EU, surely its our Govt creating the jobs not the EU or the position would be reversed?","<p class=""TweetTextSize js-tweet-text tweet-text"" data-aria-label-part=""0"" lang=""en"">What about <strong>Tata steel</strong>, can you tell me how the EU helped the <strong>steel</strong> workers?  What about all the unemployed around the EU, surely its our Govt creating the jobs not the EU <strong>or</strong> the position would be reversed?</p>"
Kapil2576,kapil bagga,950287655635378177,2018-01-08 08:46:47,/Kapil2576/status/950287655635378177,0,0,0,Steel sector in 2018?Which are top couple of companies to put money money? Tata steel or jsw or jspl or any other?,"<p class=""TweetTextSize js-tweet-text tweet-text"" data-aria-label-part=""0"" lang=""en""><strong>Steel</strong> sector in 2018?Which are top couple of companies to put money money? <strong>Tata steel</strong> <strong>or</strong> jsw <strong>or</strong> jspl <strong>or</strong> any other?</p>"
PanelResearch,Research Panel,950259548299739142,2018-01-08 06:55:05,/PanelResearch/status/950259548299739142,1,0,0,"#Stocks in the news: Sun Pharma, Shakti Pumps, Tata Steel, Sobha, Goa Carbon, Aban Offshore, NBCC
#ResearchPanel
For more Contact us @ +91-7772000003  or visit- http://researchpanel.co.in/ pic.twitter.com/5woiozr3rU","<p class=""TweetTextSize js-tweet-text tweet-text"" data-aria-label-part=""0"" lang=""en""><a class=""twitter-hashtag pretty-link js-nav"" data-query-source=""hashtag_click"" dir=""ltr"" href=""/hashtag/Stocks?src=hash""><s>#</s><b>Stocks</b></a> in the news: Sun Pharma, Shakti Pumps, <strong>Tata Steel</strong>, Sobha, Goa Carbon, Aban Offshore, NBCC
<a class=""twitter-hashtag pretty-link js-nav"" data-query-source=""hashtag_click"" dir=""ltr"" href=""/hashtag/ResearchPanel?src=hash""><s>#</s><b>ResearchPanel</b></a>
For more Contact us @ +91-7772000003  <strong>or</strong> visit- <a class=""twitter-timeline-link"" data-expanded-url=""http://researchpanel.co.in/"" dir=""ltr"" href=""https://t.co/MMMdgHUV5u"" rel=""nofollow noopener"" target=""_blank"" title=""http://researchpanel.co.in/""><span class=""tco-ellipsis""></span><span class=""invisible"">http://</span><span class=""js-display-url"">researchpanel.co.in</span><span class=""invisible"">/</span><span class=""tco-ellipsis""><span class=""invisible""> </span></span></a><a class=""twitter-timeline-link u-hidden"" data-pre-embedded=""true"" dir=""ltr"" href=""https://t.co/5woiozr3rU"">pic.twitter.com/5woiozr3rU</a></p>"
AjaySawant1801,Ajay Sawant,966518516038885376,2018-02-22 03:42:25,/AjaySawant1801/status/966518516038885376,0,0,0,Position in tata steel in March contract @700 strike price @6.50 premium ... Can I hold it  or sold it,"<p class=""TweetTextSize js-tweet-text tweet-text"" data-aria-label-part=""0"" lang=""en"">Position in <strong>tata steel</strong> in March contract <a class=""twitter-atreply pretty-link js-nav"" data-mentioned-user-id=""7636822"" dir=""ltr"" href=""/700""><s>@</s><b>700</b></a> strike price <a class=""twitter-atreply pretty-link js-nav"" data-mentioned-user-id=""662693"" dir=""ltr"" href=""/6""><s>@</s><b>6</b></a>.50 premium ... Can I hold it  <strong>or</strong> sold it</p>"
AjaySawant1801,Ajay Sawant,966518219782565888,2018-02-22 03:41:15,/AjaySawant1801/status/966518219782565888,0,0,0,"Option position in tata steel...
Strike price 700 @6.50 premium in March contract ..
Can I hold it or sold it","<p class=""TweetTextSize js-tweet-text tweet-text"" data-aria-label-part=""0"" lang=""en"">Option position in <strong>tata steel</strong>...
Strike price 700 <a class=""twitter-atreply pretty-link js-nav"" data-mentioned-user-id=""662693"" dir=""ltr"" href=""/6""><s>@</s><b>6</b></a>.50 premium in March contract ..
Can I hold it <strong>or</strong> sold it</p>"
EmmKay_RA,EMMKAY,966515634224836608,2018-02-22 03:30:58,/EmmKay_RA/status/966515634224836608,6,3,0,"Looking for gapdown following global clues and in continuation negative trend, range10330-530 and volatile market on FnO Expiry!
BO any side, extend the slide or confirm the bottom!
Stock in focus Britania/Adani entered/Prakashind/Tata Steel/Jsw steel/Titan","<p class=""TweetTextSize js-tweet-text tweet-text"" data-aria-label-part=""0"" lang=""en"">Looking for gapdown following global clues and in continuation negative trend, range10330-530 and volatile market on FnO Expiry!
BO any side, extend the slide <strong>or</strong> confirm the bottom!
Stock in focus Britania/Adani entered/Prakashind/<strong>Tata Steel</strong>/Jsw <strong>steel</strong>/Titan</p>"
piercepenniless,James B,966233598910193670,2018-02-21 08:50:16,/piercepenniless/status/966233598910193670,59,0,22,"During the Tata steel crisis, Telegraph readers might have been confused by its gentle and loving coverage of China's role. Anything to do with the £10,000 ad buy, or £800k supplement contract? Without fear, but a lot of favour. https://twitter.com/MrRFH/status/921995789328453632 …","<p class=""TweetTextSize js-tweet-text tweet-text"" data-aria-label-part=""4"" lang=""en"">During the <strong>Tata steel</strong> crisis, Telegraph readers might have been confused by its gentle and loving coverage of China's role. Anything to do with the £10,000 ad buy, <strong>or</strong> £800k supplement contract? Without fear, but a lot of favour. <a class=""twitter-timeline-link u-hidden"" data-expanded-url=""https://twitter.com/MrRFH/status/921995789328453632"" dir=""ltr"" href=""https://t.co/FwGw4M3yPe"" rel=""nofollow noopener"" target=""_blank"" title=""https://twitter.com/MrRFH/status/921995789328453632""><span class=""tco-ellipsis""></span><span class=""invisible"">https://</span><span class=""js-display-url"">twitter.com/MrRFH/status/9</span><span class=""invisible"">21995789328453632</span><span class=""tco-ellipsis""><span class=""invisible""> </span>…</span></a></p>"
ninadaranke,Ninad Aranke,965998356144279553,2018-02-20 17:15:30,/ninadaranke/status/965998356144279553,1,0,0,"These r business in trouble on paper not scam ,Bhushan. Steel like majors eg jp associate 65K cr moved to NCLT 
,So govt or banks need go by it
Today's news jindal & tata steel 
Bidding aggressively for Bhushan steel ,so 1 case of 45 k cr will b cleared for banks","<p class=""TweetTextSize js-tweet-text tweet-text"" data-aria-label-part=""0"" lang=""en"">These r business in trouble on paper not scam ,Bhushan. <strong>Steel</strong> like majors eg jp associate 65K cr moved to NCLT 
,So govt <strong>or</strong> banks need go by it
Today's news jindal &amp; <strong>tata steel</strong> 
Bidding aggressively for Bhushan <strong>steel</strong> ,so 1 case of 45 k cr will b cleared for banks</p>"
DArpitBhargava,ARPIT BHARGAVA,965815170479067136,2018-02-20 05:07:35,/DArpitBhargava/status/965815170479067136,2,0,0,"#INTRADAY CUM #BTST FUTURE CALL:

BUY #TATA #STEEL @ 655 OR TILL 650 FOR TARGETS OF 668/688+ WITH #STOPLOSS OF 648.

TRAIL YOUR STOP LOSS ONCE YOU GET IN #PROFIT.","<p class=""TweetTextSize js-tweet-text tweet-text"" data-aria-label-part=""0"" lang=""en""><a class=""twitter-hashtag pretty-link js-nav"" data-query-source=""hashtag_click"" dir=""ltr"" href=""/hashtag/INTRADAY?src=hash""><s>#</s><b>INTRADAY</b></a> CUM <a class=""twitter-hashtag pretty-link js-nav"" data-query-source=""hashtag_click"" dir=""ltr"" href=""/hashtag/BTST?src=hash""><s>#</s><b>BTST</b></a> FUTURE CALL:

BUY <a class=""twitter-hashtag pretty-link js-nav"" data-query-source=""hashtag_click"" dir=""ltr"" href=""/hashtag/TATA?src=hash""><s>#</s><b><strong>TATA</strong></b></a> <a class=""twitter-hashtag pretty-link js-nav"" data-query-source=""hashtag_click"" dir=""ltr"" href=""/hashtag/STEEL?src=hash""><s>#</s><b><strong>STEEL</strong></b></a> @ 655 <strong>OR</strong> TILL 650 FOR TARGETS OF 668/688+ WITH <a class=""twitter-hashtag pretty-link js-nav"" data-query-source=""hashtag_click"" dir=""ltr"" href=""/hashtag/STOPLOSS?src=hash""><s>#</s><b>STOPLOSS</b></a> OF 648.

TRAIL YOUR STOP LOSS ONCE YOU GET IN <a class=""twitter-hashtag pretty-link js-nav"" data-query-source=""hashtag_click"" dir=""ltr"" href=""/hashtag/PROFIT?src=hash""><s>#</s><b>PROFIT</b></a>.</p>"
Sunil29164618,Sunil,965642671170572289,2018-02-19 17:42:08,/Sunil29164618/status/965642671170572289,0,1,0,Hi ....What about tmrw tata steel stocks up or down,"<p class=""TweetTextSize js-tweet-text tweet-text"" data-aria-label-part=""0"" lang=""en"">Hi ....What about tmrw <strong>tata steel</strong> stocks up <strong>or</strong> down</p>"
